{
  "completeness": {
    "completed_folds": 2,
    "expected_folds": 2,
    "expected_rows": 60,
    "failed_rows": 0,
    "failed_tasks": [],
    "partial_tasks": [],
    "present_rows": 60
  },
  "config": {
    "config_version": "cfg_b909cd2639f37f2e",
    "uri": "runs/dra_20261009T1201_bbb222/master_config.json"
  },
  "end_time": "2026-10-09T11:22:54.454361+00:00",
  "image": "local",
  "lineage": {
    "published": "published/dra_20261009T1201_bbb222/consolidated_result.parquet",
    "report_status": "SUCCEEDED",
    "reused_from": {}
  },
  "plan": {
    "folds": [
      "f1",
      "f2"
    ],
    "targets": [
      "orders"
    ],
    "tasks": [
      {
        "fold_id": null,
        "step": "init_run",
        "target": null,
        "task_id": "init_run"
      },
      {
        "fold_id": null,
        "step": "feature_selection",
        "target": "orders",
        "task_id": "feature_selection_orders"
      },
      {
        "fold_id": null,
        "step": "confounder_selection",
        "target": "orders",
        "task_id": "confounder_selection_orders"
      },
      {
        "fold_id": "f1",
        "step": "dml",
        "target": "orders",
        "task_id": "dml_fold_orders_f1"
      },
      {
        "fold_id": "f2",
        "step": "dml",
        "target": "orders",
        "task_id": "dml_fold_orders_f2"
      },
      {
        "fold_id": null,
        "step": "consolidate",
        "target": null,
        "task_id": "consolidate"
      }
    ],
    "work_items": [
      "orders|f1",
      "orders|f2"
    ]
  },
  "run_id": "dra_20261009T1201_bbb222",
  "schema_version": "1.0",
  "snapshot": {
    "data_hash": "4d428d6c61cf97d2",
    "snapshot_id": "snap_4d428d6c61cf97d2",
    "uri": "snapshots/snap_4d428d6c61cf97d2/input.parquet"
  },
  "start_time": "2026-10-09T11:22:53.866233+00:00",
  "status": "SUCCEEDED",
  "step_toggles": {
    "confounder_selection": "on",
    "consolidation": "on",
    "dml": "on",
    "feature_selection": "on",
    "reports": "on"
  },
  "steps": {
    "confounder_selection_orders": {
      "attempt": 1,
      "cache_stats": {},
      "counters": {
        "confounder_pool_size": 3,
        "treatments_analyzed": 5
      },
      "ended_at": "2026-10-09T11:22:54.058667+00:00",
      "error": null,
      "fold_id": null,
      "outputs": [
        "confounder_selection/dra_20261009T1201_bbb222/orders/confounder_set.json"
      ],
      "run_id": "dra_20261009T1201_bbb222",
      "started_at": "2026-10-09T11:22:54.054313+00:00",
      "status": "SUCCEEDED",
      "step": "confounder_selection",
      "target": "orders",
      "task_id": "confounder_selection_orders",
      "warnings": []
    },
    "dml_fold_orders_f1": {
      "attempt": 1,
      "cache_stats": {},
      "counters": {
        "cache_hits": 40,
        "combinations": 10,
        "rows": 30,
        "rows_failed": 0,
        "units_failed": 0,
        "units_fitted": 0,
        "units_total": 40
      },
      "ended_at": "2026-10-09T11:22:54.184179+00:00",
      "error": null,
      "fold_id": "f1",
      "outputs": [
        "dml/dra_20261009T1201_bbb222/orders/fold=f1/dml_result.parquet",
        "dml/dra_20261009T1201_bbb222/orders/fold=f1/stage1_refs.parquet"
      ],
      "run_id": "dra_20261009T1201_bbb222",
      "started_at": "2026-10-09T11:22:54.060695+00:00",
      "status": "SUCCEEDED",
      "step": "dml",
      "target": "orders",
      "task_id": "dml_fold_orders_f1",
      "warnings": []
    },
    "dml_fold_orders_f2": {
      "attempt": 1,
      "cache_stats": {},
      "counters": {
        "cache_hits": 40,
        "combinations": 10,
        "rows": 30,
        "rows_failed": 0,
        "units_failed": 0,
        "units_fitted": 0,
        "units_total": 40
      },
      "ended_at": "2026-10-09T11:22:54.292038+00:00",
      "error": null,
      "fold_id": "f2",
      "outputs": [
        "dml/dra_20261009T1201_bbb222/orders/fold=f2/dml_result.parquet",
        "dml/dra_20261009T1201_bbb222/orders/fold=f2/stage1_refs.parquet"
      ],
      "run_id": "dra_20261009T1201_bbb222",
      "started_at": "2026-10-09T11:22:54.186175+00:00",
      "status": "SUCCEEDED",
      "step": "dml",
      "target": "orders",
      "task_id": "dml_fold_orders_f2",
      "warnings": []
    },
    "feature_selection_orders": {
      "attempt": 1,
      "cache_stats": {},
      "counters": {
        "kpis_evaluated": 5,
        "kpis_selected": 5
      },
      "ended_at": "2026-10-09T11:22:54.051313+00:00",
      "error": null,
      "fold_id": null,
      "outputs": [
        "feature_selection/dra_20261009T1201_bbb222/orders/selected_features.parquet",
        "feature_selection/dra_20261009T1201_bbb222/orders/fs_summary.json",
        "reports/feature_selection/dra_20261009T1201_bbb222/fs_report.xlsx"
      ],
      "run_id": "dra_20261009T1201_bbb222",
      "started_at": "2026-10-09T11:22:53.869281+00:00",
      "status": "SUCCEEDED",
      "step": "feature_selection",
      "target": "orders",
      "task_id": "feature_selection_orders",
      "warnings": []
    }
  }
}